<?xml version="1.0" encoding="UTF-8"?>
<xs:schema xmlns:xs="http://www.w3.org/2001/XMLSchema">
    <xs:element name="code">
        <xs:complexType>
            <xs:sequence>
                <xs:element name="language" type="languageType" minOccurs="1" maxOccurs="unbounded"/>
            </xs:sequence>
        </xs:complexType>
    </xs:element>
    <xs:complexType name="languageType">
        <xs:sequence>
            <xs:element name="name" type="xs:string"/>
            <xs:element name="description" type="xs:string"/>
            <xs:element name="type" type="xs:string"/>
            <xs:element name="application" type="applicationType"/>
        </xs:sequence>
    </xs:complexType>
    <xs:complexType name="applicationType">
        <xs:sequence>
            <xs:element name="name" type="xs:string" minOccurs="1" maxOccurs="unbounded"/>
        </xs:sequence>
    </xs:complexType>
</xs:schema>